ID,Title,Location,Description,StartDate,EndDate,Fonction
1,Développeur Backend,Rabat,Conception et développement de services RESTful en Java.,2024-01-15,2024-12-30,Développement logiciel
2,Ingénieur QA,Casablanca,Réalisation de tests automatisés pour les applications Java.,2023-11-01,2024-05-31,Test logiciel
3,Architecte Logiciel,Tanger,Conception de l'architecture des applications Java d'entreprise.,2024-03-01,2025-02-28,Architecture logicielle
4,Développeur Fullstack,Agadir,Développement d'applications web Java avec une interface utilisateur moderne.,2023-09-01,2024-06-30,Développement logiciel
5,Chef de Projet,Marrakech,Gestion des projets Java en collaboration avec des équipes multidisciplinaires.,2023-12-01,2024-11-30,Gestion de projet
6,Analyste Fonctionnel,Fès,Analyse des besoins métiers et rédaction des spécifications pour des projets Java.,2024-02-01,2024-08-31,Analyse fonctionnelle
